{
  "schema": "excavaguard.period_report_input/v1",
  "contract": {
    "producer": "确定性计算层 · 三阶段流水线",
    "consumer": "日报生成 Agent（后续独立实现，本层不实现）",
    "stability": "字段只增不改；新增字段向后兼容；破坏性变更须升级 schema 版本号",
    "schema_file": "确定性计算层/contracts/period_report_input.schema.json",
    "excludes": [
      "日报正文",
      "日报版式文件",
      "结论性建议措辞",
      "规范原文引用全文"
    ]
  },
  "generated_from": {
    "stage1": "阶段一 · 数据准备",
    "stage2": "阶段二 · 确定性计算",
    "stage3": "阶段三 · 规范比对"
  },
  "project": {
    "name": "完全人工合成测试_不含真实工程数据",
    "monitoring_unit": null,
    "report_date": "2026-10-08",
    "excavation_stage": null,
    "excavation_depth_m": null,
    "safety_level": null,
    "support_type": null
  },
  "context": {
    "real_records": 0,
    "simulated_records": 1,
    "records": 1,
    "history_records": 8,
    "item_date": null,
    "effective_standard_origin": "default_library",
    "effective_standard_stage": "阶段三 · 规范比对",
    "real_is_primary": true,
    "simulated_note": "模拟数据仅用于验证流程健壮性，不替代真实数据，统计时与真实数据分开。"
  },
  "standards_sources": [
    {
      "origin": "default_library",
      "origin_display": "默认规范库（基坑智守项目相关规范）",
      "source_id": "GB50497-2019",
      "source_label": "GB 50497-2019《建筑基坑工程监测技术标准》",
      "source_type": "national_standard",
      "path": "确定性计算层/standards/default/thresholds_gb50497_2019.json",
      "metric_count": 22
    }
  ],
  "data_quality": {
    "issue_count": 0,
    "by_code": {},
    "blocked_records": 0
  },
  "summary": {
    "total": 1,
    "by_risk_level": {
      "危险报警": 1
    },
    "by_problem_category": {
      "变形过大": 1
    },
    "by_data_origin": {
      "simulated": 1
    },
    "abstain": {},
    "overall_risk_level": "危险报警"
  },
  "alerts": [
    {
      "point_id": "SIMULATED-P-01",
      "point_name": null,
      "point_type": null,
      "metric_key": "wall_top_horizontal_displacement",
      "metric_name": "围护墙（边坡）顶部水平位移",
      "timestamp": "2026-10-08 00:00:00",
      "data_origin": "simulated",
      "baseline": 0.0,
      "previous": 60.0,
      "current": 62.0,
      "interval_days": 1.0,
      "measurement_semantics": "raw_observation",
      "source_flags": [],
      "source_metadata": {},
      "cumulative": 62.0,
      "single_change": 2.0,
      "rate": 2.0,
      "slope": 10.023809523809524,
      "problem_category": "变形过大",
      "risk_level": "危险报警",
      "utilization": 3.1,
      "checks": [
        {
          "check": "累计值",
          "value": 62.0,
          "limit": 20.0,
          "limit_basis": "min(绝对量 20 mm, 0.2%×H=40 mm) = 20 mm",
          "utilization": 3.1,
          "verdict": "危险报警"
        },
        {
          "check": "变化速率",
          "value": 2.0,
          "limit": 2.0,
          "limit_basis": "规范速率预警值",
          "utilization": 1.0,
          "consecutive_over_70": true,
          "verdict": "报警"
        }
      ],
      "effective_standard": {
        "origin": "default_library",
        "origin_display": "默认规范库（基坑智守项目相关规范）",
        "source_id": "GB50497-2019",
        "source_label": "GB 50497-2019《建筑基坑工程监测技术标准》",
        "rule_id": "WTHD-L1-PILE",
        "overridden_fields": [],
        "looser_details": []
      },
      "rule_id": "WTHD-L1-PILE",
      "evidence": {
        "standard": "GB 50497-2019",
        "clause": "表8.0.4",
        "note": "灌注桩、地下连续墙、钢板桩、型钢水泥土墙"
      },
      "abstain": [],
      "abstain_reasons": [],
      "flags": [
        "BASELINE_DERIVED",
        "PREVIOUS_DERIVED",
        "INTERVAL_DERIVED"
      ],
      "needs_review": false
    }
  ],
  "review_queue": [],
  "standard_override_warnings": [],
  "items": [
    {
      "point_id": "SIMULATED-P-01",
      "point_name": null,
      "point_type": null,
      "metric_key": "wall_top_horizontal_displacement",
      "metric_name": "围护墙（边坡）顶部水平位移",
      "timestamp": "2026-10-08 00:00:00",
      "data_origin": "simulated",
      "baseline": 0.0,
      "previous": 60.0,
      "current": 62.0,
      "interval_days": 1.0,
      "measurement_semantics": "raw_observation",
      "source_flags": [],
      "source_metadata": {},
      "cumulative": 62.0,
      "single_change": 2.0,
      "rate": 2.0,
      "slope": 10.023809523809524,
      "problem_category": "变形过大",
      "risk_level": "危险报警",
      "utilization": 3.1,
      "checks": [
        {
          "check": "累计值",
          "value": 62.0,
          "limit": 20.0,
          "limit_basis": "min(绝对量 20 mm, 0.2%×H=40 mm) = 20 mm",
          "utilization": 3.1,
          "verdict": "危险报警"
        },
        {
          "check": "变化速率",
          "value": 2.0,
          "limit": 2.0,
          "limit_basis": "规范速率预警值",
          "utilization": 1.0,
          "consecutive_over_70": true,
          "verdict": "报警"
        }
      ],
      "effective_standard": {
        "origin": "default_library",
        "origin_display": "默认规范库（基坑智守项目相关规范）",
        "source_id": "GB50497-2019",
        "source_label": "GB 50497-2019《建筑基坑工程监测技术标准》",
        "rule_id": "WTHD-L1-PILE",
        "overridden_fields": [],
        "looser_details": []
      },
      "rule_id": "WTHD-L1-PILE",
      "evidence": {
        "standard": "GB 50497-2019",
        "clause": "表8.0.4",
        "note": "灌注桩、地下连续墙、钢板桩、型钢水泥土墙"
      },
      "abstain": [],
      "abstain_reasons": [],
      "flags": [
        "BASELINE_DERIVED",
        "PREVIOUS_DERIVED",
        "INTERVAL_DERIVED"
      ],
      "needs_review": false
    }
  ],
  "disclaimer": "阈值取自现行规范条文（见各条目 evidence 字段），实际工程使用前须经设计方确认；本载荷为结构化中间结果，不含日报结论与建议措辞。",
  "note": "周期明细按选定区间统计，区间之前的历史仅用于计算；每通道附表展示周期最严重原观测，非期末值。未知、缺测独立披露。宽表沿用每日末值，日内极值未经独立风险判定，须结合原数据复核。工程条件和判据按本次输入统一应用，期间如有变化须分段重算。",
  "period": {
    "type": "weekly",
    "start_date": "2026-10-02",
    "end_date": "2026-10-08",
    "label": "监测周报",
    "timezone": "Asia/Shanghai",
    "calendar_days": 7,
    "observed_days": 7,
    "missing_dates": [],
    "observation_count": 7,
    "channel_count": 1,
    "warning_point_days": 7,
    "unknown_observation_count": 0,
    "daily_summaries": [
      {
        "date": "2026-10-02",
        "observation_count": 1,
        "warning_count": 1,
        "unknown_count": 0,
        "worst_known_risk": "危险报警",
        "missing": false,
        "content_hash": "2886796235ce7fb878af575b150a7839af2a75e9e7a759969bb46efae6177db1"
      },
      {
        "date": "2026-10-03",
        "observation_count": 1,
        "warning_count": 1,
        "unknown_count": 0,
        "worst_known_risk": "危险报警",
        "missing": false,
        "content_hash": "67962ff608e7ea0d6b07fa3419fa37621c91e7c721d000a6b5422dd7b777769a"
      },
      {
        "date": "2026-10-04",
        "observation_count": 1,
        "warning_count": 1,
        "unknown_count": 0,
        "worst_known_risk": "危险报警",
        "missing": false,
        "content_hash": "7dcab1e95fefad99caf90fd99282b3d701c326aed950d5b557951ee265f3778b"
      },
      {
        "date": "2026-10-05",
        "observation_count": 1,
        "warning_count": 1,
        "unknown_count": 0,
        "worst_known_risk": "危险报警",
        "missing": false,
        "content_hash": "41181268467a29920ea5e6bae19b75a2dfef9c3e0fb816b009a7fca697fdc3f0"
      },
      {
        "date": "2026-10-06",
        "observation_count": 1,
        "warning_count": 1,
        "unknown_count": 0,
        "worst_known_risk": "危险报警",
        "missing": false,
        "content_hash": "4acadf4b9049913f59ee92bd9a35294c50949e4ac034d108b6adb324417cb6a6"
      },
      {
        "date": "2026-10-07",
        "observation_count": 1,
        "warning_count": 1,
        "unknown_count": 0,
        "worst_known_risk": "危险报警",
        "missing": false,
        "content_hash": "af5bb9f1fb1fe488d26c0796ee6c8e423a7d88a7ce580baf66170d1868e478d1"
      },
      {
        "date": "2026-10-08",
        "observation_count": 1,
        "warning_count": 1,
        "unknown_count": 0,
        "worst_known_risk": "危险报警",
        "missing": false,
        "content_hash": "72b4266a7ea4c0f673159c033579c26eb376f59409bfdf5c6a384e4baed12b17"
      }
    ],
    "channels": [
      {
        "point_id": "SIMULATED-P-01",
        "metric_key": "wall_top_horizontal_displacement",
        "metric_name": "围护墙（边坡）顶部水平位移",
        "observed_days": 7,
        "missing_dates": [],
        "warning_days": 7,
        "warning_dates": [
          "2026-10-02",
          "2026-10-03",
          "2026-10-04",
          "2026-10-05",
          "2026-10-06",
          "2026-10-07",
          "2026-10-08"
        ],
        "max_consecutive_warning_days": 7,
        "unknown_days": 0,
        "unknown_dates": [],
        "worst_known_risk": "危险报警",
        "first_observation_date": "2026-10-02",
        "last_observation_date": "2026-10-08",
        "first_current": 5.0,
        "last_current": 62.0,
        "representative_timestamp": "2026-10-08 00:00:00"
      }
    ],
    "recurring_warnings": [
      {
        "point_id": "SIMULATED-P-01",
        "metric_key": "wall_top_horizontal_displacement",
        "metric_name": "围护墙（边坡）顶部水平位移",
        "observed_days": 7,
        "missing_dates": [],
        "warning_days": 7,
        "warning_dates": [
          "2026-10-02",
          "2026-10-03",
          "2026-10-04",
          "2026-10-05",
          "2026-10-06",
          "2026-10-07",
          "2026-10-08"
        ],
        "max_consecutive_warning_days": 7,
        "unknown_days": 0,
        "unknown_dates": [],
        "worst_known_risk": "危险报警",
        "first_observation_date": "2026-10-02",
        "last_observation_date": "2026-10-08",
        "first_current": 5.0,
        "last_current": 62.0,
        "representative_timestamp": "2026-10-08 00:00:00"
      }
    ],
    "aggregation_policy": "daily-facts/v1; distinct warning days >= 2; unknown and missing disclosed separately",
    "daily_items": [
      {
        "point_id": "SIMULATED-P-01",
        "point_name": null,
        "point_type": null,
        "metric_key": "wall_top_horizontal_displacement",
        "metric_name": "围护墙（边坡）顶部水平位移",